index;filename;number;title;group;subgroup
810;811.txt;811;Boże, coś Polskę przez tak liczne wieki;IV. Społeczność Świętych;20. Zgromadzenie wierzących
811;812.txt;812;Łaska naszego Chrystusa i Pana;IV. Społeczność Świętych;20. Zgromadzenie wierzących
812;813.txt;813;Od ojczystej naszej ziemi;IV. Społeczność Świętych;20. Zgromadzenie wierzących
813;814.txt;814;O, jak pięknie w zgodzie żyć;IV. Społeczność Świętych;20. Zgromadzenie wierzących
814;815.txt;815;O, jakże kocham Twój;IV. Społeczność Świętych;20. Zgromadzenie wierzących
815;816.txt;816;Płyną z serca, płyną w niebo;IV. Społeczność Świętych;20. Zgromadzenie wierzących
816;817.txt;817;Pociechę niebiańską nam Zbawca dał;IV. Społeczność Świętych;20. Zgromadzenie wierzących
817;818.txt;818;Prowadzimy tu życie tułacze;IV. Społeczność Świętych;20. Zgromadzenie wierzących
818;819.txt;819;Teraz już się rozstajemy;IV. Społeczność Świętych;20. Zgromadzenie wierzących
819;820.txt;820;Wspaniały świat, prawdziwy raj;IV. Społeczność Świętych;20. Zgromadzenie wierzących
820;821.txt;821;Zbawieni — to szczęśliwa rzesza;IV. Społeczność Świętych;20. Zgromadzenie wierzących
821;822.txt;822;Chciałbym się wzbić lotem orła hen;IV. Społeczność Świętych;21. Dla młodzieży
822;823.txt;823;Chętnie, żwawo, my pielgrzymi ziemscy ;IV. Społeczność Świętych;21. Dla młodzieży
823;824.txt;824;Drobne piasku ziarnka;IV. Społeczność Świętych;21. Dla młodzieży
824;825.txt;825;Dzieci, jeszcześmy w podróży;IV. Społeczność Świętych;21. Dla młodzieży
825;826.txt;826;Ja nie ma m złota, ni łąk zielonych;IV. Społeczność Świętych;21. Dla młodzieży
826;827.txt;827;Jak prędko dolała do mety swej grot;IV. Społeczność Świętych;21. Dla młodzieży
827;828.txt;828;Jestem jeszcze dziecię małe;IV. Społeczność Świętych;21. Dla młodzieży
828;829.txt;829;Kto ma tak piękne trzody?;IV. Społeczność Świętych;21. Dla młodzieży
829;830.txt;830;Młodości dni, dni szczęścia złotej chwili;IV. Społeczność Świętych;21. Dla młodzieży
830;831.txt;831;Młodości moja, byłaś tak cudna;IV. Społeczność Świętych;21. Dla młodzieży
831;832.txt;832;Młodości moja;IV. Społeczność Świętych;21. Dla młodzieży
832;833.txt;833;Mój Jezus kocha mnie;IV. Społeczność Świętych;21. Dla młodzieży
833;834.txt;834;Niech moim sercem Pan Jezus wciąż włada;IV. Społeczność Świętych;21. Dla młodzieży
834;835.txt;835;Niedzielna szkółka milsza mi;IV. Społeczność Świętych;21. Dla młodzieży
835;836.txt;836;Pamiętam jeszcze dobrze;IV. Społeczność Świętych;21. Dla młodzieży
836;837.txt;837;Piękne dni życia naszego;IV. Społeczność Świętych;21. Dla młodzieży
837;838.txt;838;Pójdźcie dziatki, pójdźcie;IV. Społeczność Świętych;21. Dla młodzieży
838;839.txt;839;Prowadź, Jezu, Twoje dziecię;IV. Społeczność Świętych;21. Dla młodzieży
839;840.txt;840;Przyjaciel małych dzieci jest Chrystus, Zbawca nasz;IV. Społeczność Świętych;21. Dla młodzieży
840;841.txt;841;Rannego słońca pierwszy promyk lśni;IV. Społeczność Świętych;21. Dla młodzieży
841;842.txt;842;Spracowany idę spać;IV. Społeczność Świętych;21. Dla młodzieży
842;843.txt;843;W drodze już jesteśmy;IV. Społeczność Świętych;21. Dla młodzieży
843;844.txt;844;Wiernie w ślad za Jezusem;IV. Społeczność Świętych;21. Dla młodzieży
844;845.txt;845;Wiosna nadeszła, cieszmy się;IV. Społeczność Świętych;21. Dla młodzieży
845;846.txt;846;W jednym małym kątku;IV. Społeczność Świętych;21. Dla młodzieży
846;847.txt;847;W potężnych rękach Pana;IV. Społeczność Świętych;21. Dla młodzieży
847;848.txt;848;Wróbelków małych kocha Bóg;IV. Społeczność Świętych;21. Dla młodzieży
848;849.txt;849;Wspominam te chwile gdy byłem dzieciną;IV. Społeczność Świętych;21. Dla młodzieży
849;850.txt;850;Zgodnie, bracia, chcemy wszyscy razem;IV. Społeczność Świętych;21. Dla młodzieży
850;851.txt;851;Błogosław Panie, na ich ślubowanie;IV. Społeczność Świętych;22. Ślub
851;852.txt;852;Daj Boże Swym dziatkom na wszystkie ich dni;IV. Społeczność Świętych;22. Ślub
852;853.txt;853;Wasze serca, wasze dłonie;IV. Społeczność Świętych;22. Ślub
853;854.txt;854;Zbawiciel w Kanie Galilejskiej;IV. Społeczność Świętych;22. Ślub
854;855.txt;855;Z dwóch serc, o Panie, jedno stwórz;IV. Społeczność Świętych;22. Ślub
855;856.txt;856;Do grobu proch kładziemy;IV. Społeczność Świętych;23. Pogrzeb
856;857.txt;857;Gdy słońce zajdzie nad naszą ziemią;IV. Społeczność Świętych;23. Pogrzeb
857;858.txt;858;To życie jest jak cień;IV. Społeczność Świętych;23. Pogrzeb
858;859.txt;859;Już ostatni za górami promień słońca zgasł;IV. Społeczność Świętych;24. Pory dnia i roku
859;860.txt;860;Z szybkością wiatru czas przemija;IV. Społeczność Świętych;24. Pory dnia i roku
860;I.txt;I;Do śmierci z Biblią świętą;IV. Społeczność Świętych;25. Addenda
861;II.txt;II;Dzięki, kochany Ojcze z nieba;IV. Społeczność Świętych;25. Addenda
862;III.txt;III;Dzieci Boże, chodźcie wznieść;IV. Społeczność Świętych;25. Addenda
863;IV.txt;IV;Dzięki Tobie za Twe dary;IV. Społeczność Świętych;25. Addenda
864;V.txt;V;Gdy rozmyślam, Święty Boże;IV. Społeczność Świętych;25. Addenda
865;VI.txt;VI;Jakie drogie dziś chwile;IV. Społeczność Świętych;25. Addenda
866;VII.txt;VII;Możesz poznać Pana dziś!;IV. Społeczność Świętych;25. Addenda
867;VIII.txt;VIII;My mamy pewną skałę;IV. Społeczność Świętych;25. Addenda
868;IX.txt;IX;Prowadź, prowadź mnie Sam;IV. Społeczność Świętych;25. Addenda
869;X.txt;X;Wszystkie nasze dzienne sprawy;IV. Społeczność Świętych;25. Addenda
870;XI.txt;XI;Choćbym wszystko miał;IV. Społeczność Świętych;25. Addenda
871;XII.txt;XII;Niegdyś gdy byłem w kajdanach grzechu;IV. Społeczność Świętych;25. Addenda
872;XIII.txt;XIII;Z głębi serc tych dwojga wzlata;IV. Społeczność Świętych;25. Addenda
873;XIV.txt;XIV;O, nie smuć się, lecz walcz z niedolą;IV. Społeczność Świętych;25. Addenda
874;XV.txt;XV;Z smutku, niedoli, zmartwień i trosk;IV. Społeczność Świętych;25. Addenda
